[
  {
    "id": "yijing-obs-001",
    "pilgrim": "Yijing",
    "topic": "school-distribution",
    "region": "Central India (Magadha)",
    "claim": "In Magadha all four Nikāyas are practised side by side, but the Sarvāstivāda flourishes the most.",
    "yana": [
      "Śrāvakayāna"
    ],
    "sect": [
      "Sarvastivada",
      "Mahasamghika",
      "Sthavira",
      "Sammitiya"
    ],
    "source": {
      "work": "A Record of the Buddhist Religion as Practised in India and the Malay Archipelago (Takakusu)",
      "ref": "General Introduction — distribution of the schools (p. 9)",
      "quote": "In Magadha (Central India) the doctrines of the four Nikāyas are generally in practice, yet the Sarvāstivādanikāya flourishes the most."
    }
  },
  {
    "id": "yijing-obs-002",
    "pilgrim": "Yijing",
    "topic": "school-distribution",
    "region": "Western India (Lāṭa and Sindhu)",
    "claim": "In Lāṭa and Sindhu (Western India) the Sammitīya has the greatest number of followers, with a few members of the other three schools.",
    "yana": [
      "Śrāvakayāna"
    ],
    "sect": [
      "Sammitiya"
    ],
    "source": {
      "work": "A Record of the Buddhist Religion as Practised in India and the Malay Archipelago (Takakusu)",
      "ref": "General Introduction — distribution of the schools (p. 10)",
      "quote": "the Sammitinikaya has the greater number of followers, and there are some few members of the other three schools."
    }
  },
  {
    "id": "yijing-obs-003",
    "pilgrim": "Yijing",
    "topic": "school-distribution",
    "region": "Northern India",
    "claim": "In Northern India almost all belong to the Sarvāstivāda, though followers of the Mahāsāṃghika are sometimes met; the Sthavira and Sammitīya are not found there.",
    "yana": [
      "Śrāvakayāna"
    ],
    "sect": [
      "Sarvastivada",
      "Mahasamghika"
    ],
    "source": {
      "work": "A Record of the Buddhist Religion as Practised in India and the Malay Archipelago (Takakusu)",
      "ref": "General Introduction — distribution of the schools (p. 10)",
      "quote": "In the northern region (N. India) all belong to the Sarvāstivādanikāya"
    }
  },
  {
    "id": "yijing-obs-004",
    "pilgrim": "Yijing",
    "topic": "school-distribution",
    "region": "Southern India",
    "claim": "Towards the South all follow the Sthavira, though a few adherents of the other Nikāyas exist.",
    "yana": [
      "Śrāvakayāna"
    ],
    "sect": [
      "Sthavira"
    ],
    "source": {
      "work": "A Record of the Buddhist Religion as Practised in India and the Malay Archipelago (Takakusu)",
      "ref": "General Introduction — distribution of the schools (p. 10)",
      "quote": "Towards the South (S. India), all follow the Sthaviranikāya, though there exist a few adherents of the other Nikāyas."
    }
  },
  {
    "id": "yijing-obs-005",
    "pilgrim": "Yijing",
    "topic": "school-distribution",
    "region": "Eastern India (the eastern frontier countries)",
    "claim": "In the eastern frontier countries the four Nikāyas are found side by side.",
    "yana": [
      "Śrāvakayāna"
    ],
    "sect": [
      "Mahasamghika",
      "Sthavira",
      "Mulasarvastivada",
      "Sammitiya"
    ],
    "source": {
      "work": "A Record of the Buddhist Religion as Practised in India and the Malay Archipelago (Takakusu)",
      "ref": "General Introduction — distribution of the schools (p. 10)",
      "quote": "In the eastern frontier countries (E. India), the four Nikāyas are found side by side"
    }
  },
  {
    "id": "yijing-obs-006",
    "pilgrim": "Yijing",
    "topic": "school-distribution",
    "region": "The islands of the Southern Sea (Sumatra, Java and neighbouring isles)",
    "claim": "In the more than ten countries of the Southern Sea the Mūlasarvāstivāda has been almost universally adopted, with occasional Sammitīya and, recently, a few of the other two schools. This is I-tsing's own school and directly corroborates that the school Xuanzang's translator renders simply as 'Sarvāstivāda' was, for I-tsing, the Mūlasarvāstivāda.",
    "yana": [
      "Śrāvakayāna"
    ],
    "sect": [
      "Mulasarvastivada",
      "Sammitiya"
    ],
    "source": {
      "work": "A Record of the Buddhist Religion as Practised in India and the Malay Archipelago (Takakusu)",
      "ref": "General Introduction — distribution of the schools (pp. 10–11)",
      "quote": "In the islands of the Southern Sea-consisting of more than ten countries-the Mūlasarvāstivādanikāya has been almost universally adopted"
    }
  },
  {
    "id": "yijing-obs-007",
    "pilgrim": "Yijing",
    "topic": "school-distribution",
    "region": "Champa (Cochin-China / Lin-i)",
    "claim": "In Champa Buddhists generally belong to the Sammitīya, with a few followers of the Sarvāstivāda.",
    "yana": [
      "Śrāvakayāna"
    ],
    "sect": [
      "Sammitiya",
      "Sarvastivada"
    ],
    "source": {
      "work": "A Record of the Buddhist Religion as Practised in India and the Malay Archipelago (Takakusu)",
      "ref": "General Introduction — distribution of the schools (p. 12)",
      "quote": "In this country Buddhists generally belong to the Āryasammiti- nikāya, and there are also a few followers of the Sarvāstivādanikāya."
    }
  },
  {
    "id": "yijing-obs-008",
    "pilgrim": "Yijing",
    "topic": "school-distribution",
    "region": "Funan / Poh-nan (Siam, with part of Cambodia)",
    "claim": "In Funan Buddhism once flourished but a wicked king has expelled and exterminated the Buddhist community, so that no monks remain and only adherents of other religions live there.",
    "yana": [
      "non-Buddhist"
    ],
    "sect": [],
    "source": {
      "work": "A Record of the Buddhist Religion as Practised in India and the Malay Archipelago (Takakusu)",
      "ref": "General Introduction — distribution of the schools (p. 12)",
      "quote": "later on, Buddhism flourished there, but a wicked king has now expelled and exterminated them all, and there are no members of the Buddhist Brotherhood at all"
    }
  },
  {
    "id": "yijing-obs-009",
    "pilgrim": "Yijing",
    "topic": "school-distribution",
    "region": "China",
    "claim": "In China Buddhists mostly follow the Dharmagupta school; the Mahāsāṃghika has long been kept in places of Shen-si, and the Sarvāstivāda formerly flourished in the south (Kiang-nan, Kwang-tung and Kwang-si).",
    "yana": [
      "Mahāyāna",
      "Śrāvakayāna"
    ],
    "sect": [
      "Dharmaguptaka",
      "Mahasamghika",
      "Sarvastivada"
    ],
    "source": {
      "work": "A Record of the Buddhist Religion as Practised in India and the Malay Archipelago (Takakusu)",
      "ref": "General Introduction — distribution of the schools (p. 13)",
      "quote": "In the Eastern Hsia (i.e. China) Buddhists practise mostly according to the Dharmagupta school"
    }
  },
  {
    "id": "yijing-obs-010",
    "pilgrim": "Yijing",
    "topic": "yana",
    "region": "China",
    "claim": "China in general belongs to the Mahāyāna.",
    "yana": [
      "Mahāyāna"
    ],
    "sect": [],
    "source": {
      "work": "A Record of the Buddhist Religion as Practised in India and the Malay Archipelago (Takakusu)",
      "ref": "General Introduction — The Mahāyāna and the Smaller Vehicle (p. xxv)",
      "quote": "China in general belongs to the Mahāyāna."
    }
  },
  {
    "id": "yijing-obs-011",
    "pilgrim": "Yijing",
    "topic": "yana",
    "region": "India (the remaining regions)",
    "claim": "In the remaining places of India both vehicles are found — some practise according to the one, some according to the other (Northern India and the Southern Sea islands generally following the Śrāvakayāna, China the Mahāyāna).",
    "yana": [
      "Mahāyāna",
      "Śrāvakayāna"
    ],
    "sect": [],
    "source": {
      "work": "A Record of the Buddhist Religion as Practised in India and the Malay Archipelago (Takakusu)",
      "ref": "General Introduction — The Mahāyāna and the Smaller Vehicle (p. xxv)",
      "quote": "All the remaining places in India. Both Yānas are found, i.e. some practise according to the one, some according to the other."
    }
  },
  {
    "id": "yijing-obs-012",
    "pilgrim": "Yijing",
    "topic": "yana",
    "region": "India (general — the nature of the Mahāyāna)",
    "claim": "I-tsing distinguishes two kinds of Mahāyāna: the Mādhyamika (all things are an empty show) and the Yoga / Yogācāra (only inward thought is real); both equally conform to truth and lead to Nirvāṇa.",
    "yana": [
      "Mahāyāna"
    ],
    "sect": [],
    "source": {
      "work": "A Record of the Buddhist Religion as Practised in India and the Malay Archipelago (Takakusu)",
      "ref": "General Introduction — The Mahāyāna and the Smaller Vehicle (p. 15)",
      "quote": "There are but two kinds of the so-called Mahāyāna. First, the Mādhyamika; second, the Yoga."
    }
  },
  {
    "id": "yijing-obs-013",
    "pilgrim": "Yijing",
    "topic": "yana",
    "region": "Malayu / Śrībhoga (Sumatra) and the Southern Sea",
    "claim": "The Southern Sea islands generally follow the Śrāvakayāna (the 'smaller vehicle'); only in Malayu (now Śrībhoga) are there a few who belong to the Mahāyāna.",
    "yana": [
      "Śrāvakayāna",
      "Mahāyāna"
    ],
    "sect": [
      "Mulasarvastivada"
    ],
    "source": {
      "work": "A Record of the Buddhist Religion as Practised in India and the Malay Archipelago (Takakusu)",
      "ref": "General Introduction — The Mahāyāna and the Smaller Vehicle (p. xxv)",
      "quote": "Malayu (= Śrībhoga), a few Mahāyānists."
    }
  },
  {
    "id": "yijing-obs-014",
    "pilgrim": "Yijing",
    "topic": "school-distribution",
    "region": "Bodh Gayā (the Mahābodhi monastery)",